{
    "campaignId": "sample-campaign",
    "titleKey": "campaign.title",
    "descriptionKey": "campaign.description",
    "players": [1],
    "missions": {
        "mission01": {
            "victoryUnlocks": ["mission02", "mission03"]
        },
        "mission02": {},
        "mission03": {},
        "mission04": {
            "prerequisites": ["mission02", "mission03"]
        }
    },
    "startMission": ["mission01"],
    "finalMission": ["mission04"],
    "compatibility": [
        {
            "engineVersion": "2025.04.10",
            "gameVersions": ["Beyond All Reason test-28000-aaaaaaa", "Beyond All Reason test-28100-bbbbbbb"]
        }
    ]
}
