{
    "$schema": "../../../../../schemas/content/campaign-config.schema.json",
    "campaignId": "second-campaign",
    "titleKey": "campaign.title",
    "descriptionKey": "campaign.description",
    "backgroundImage": "background2.png",
    "logo": "second-logo.png",
    "players": [1],
    "settings": {
        "replayableMissions": true
    },
    "missions": {
        "landing": {
            "victoryUnlocks": ["northRoute", "southRoute"],
            "failureUnlocks": ["supplyRun"]
        },
        "supplyRun": {
            "victoryRemoves": ["supplyRun"]
        },
        "northRoute": {
            "victoryUnlocks": ["finale"],
            "victoryRemoves": ["southRoute"]
        },
        "southRoute": {
            "victoryUnlocks": ["finale"],
            "victoryRemoves": ["northRoute"]
        },
        "finale": {
            "settings": {
                "replayable": false
            }
        }
    },
    "startMission": ["landing"],
    "finalMission": ["finale"],
    "compatibility": [
        {
            "engineVersion": "2025.04.10",
            "gameVersions": ["Beyond All Reason test-28000-aaaaaaa", "Beyond All Reason test-28100-bbbbbbb"]
        },
        {
            "engineVersion": "2025.06.01",
            "gameVersions": ["Beyond All Reason test-28100-bbbbbbb", "Beyond All Reason test-28200-ccccccc"]
        }
    ]
}
